<!-- Fig. 15.9: letter.dtd        -->
<!-- DTD document for letter.xml  -->

<!ELEMENT letter ( contact+, salutation, paragraph+, 
   closing, signature )>

<!ELEMENT contact ( name, address1, address2, city, state, 
   zip, phone, flag )>
<!ATTLIST contact type CDATA #IMPLIED>

<!ELEMENT name ( #PCDATA )>
<!ELEMENT address1 ( #PCDATA )>
<!ELEMENT address2 ( #PCDATA )>
<!ELEMENT city ( #PCDATA )>
<!ELEMENT state ( #PCDATA )>
<!ELEMENT zip ( #PCDATA )>
<!ELEMENT phone ( #PCDATA )>
<!ELEMENT flag EMPTY>
<!ATTLIST flag gender (M | F) "M">

<!ELEMENT salutation ( #PCDATA )>
<!ELEMENT closing ( #PCDATA )>
<!ELEMENT paragraph ( #PCDATA )>
<!ELEMENT signature ( #PCDATA )>


<!-- 
 ************************************************************************** 
 * (C) Copyright 1992-2012 by Deitel & Associates, Inc. and               *
 * Pearson Education, Inc. All Rights Reserved.                           *
 *                                                                        *
 * DISCLAIMER: The authors and publisher of this book have used their     *
 * best efforts in preparing the book. These efforts include the          *
 * development, research, and testing of the theories and programs        *
 * to determine their effectiveness. The authors and publisher make       *
 * no warranty of any kind, expressed or implied, with regard to these    *
 * programs or to the documentation contained in these books. The authors *
 * and publisher shall not be liable in any event for incidental or       *
 * consequential damages in connection with, or arising out of, the       *
 * furnishing, performance, or use of these programs.                     *
 **************************************************************************
-->