<?xml version = "1.0"?>

<!-- Fig. 15.4: letter.xml -->
<!-- Business letter marked up as XML -->
<!DOCTYPE letter SYSTEM "letter.dtd">

<letter>
   <contact type = "sender">
      <name>Jane Doe</name>
      <address1>Box 12345</address1>
      <address2>15 Any Ave.</address2>
      <city>Othertown</city>
      <state>Otherstate</state>
      <zip>67890</zip>
      <phone>555-4321</phone>
      <flag gender = "F" />
   </contact>

   <contact type = "receiver">
      <name>John Doe</name>
      <address1>123 Main St.</address1>
      <address2></address2>
      <city>Anytown</city>
      <state>Anystate</state>
      <zip>12345</zip>
      <phone>555-1234</phone>
      <flag gender = "M" />
   </contact>

   <salutation>Dear Sir:</salutation>

   <paragraph>It is our privilege to inform you about our new database
      managed with XML. This new system allows you to reduce the 
      load on your inventory list server by having the client machine
      perform the work of sorting and filtering the data.
   </paragraph>

   <paragraph>Please visit our website for availability and pricing.
   </paragraph>

   <closing>Sincerely,</closing>
   <signature>Ms. Jane Doe</signature>
</letter>


<!-- 
 ************************************************************************** 
 * (C) Copyright 1992-2012 by Deitel & Associates, Inc. and               *
 * Pearson Education, Inc. All Rights Reserved.                           *
 *                                                                        *
 * DISCLAIMER: The authors and publisher of this book have used their     *
 * best efforts in preparing the book. These efforts include the          *
 * development, research, and testing of the theories and programs        *
 * to determine their effectiveness. The authors and publisher make       *
 * no warranty of any kind, expressed or implied, with regard to these    *
 * programs or to the documentation contained in these books. The authors *
 * and publisher shall not be liable in any event for incidental or       *
 * consequential damages in connection with, or arising out of, the       *
 * furnishing, performance, or use of these programs.                     *
 **************************************************************************
-->